{
  "version": "1.0",

  "merge_request": {
    "id": "!418",
    "title": "Cache session tokens in Redis",
    "source_branch": "feat/session-cache",
    "target_branch": "main",
    "base_sha": "8f21ac3",
    "head_sha": "d40be91"
  },

  "overview": {
    "what": "A Redis cache is placed in front of session token verification. The public contract of TokenService.verify() is unchanged: same signature, same exceptions, same ordering of checks.",
    "why": "Every authenticated request currently makes a Postgres round trip to re-validate a token that was verified milliseconds earlier. At the morning peak this accounts for 40% of queries hitting the database.",
    "risks": "A revoked token left in the cache would be accepted as valid. Step 4 handles this; it is the step that deserves the most attention.",
    "out_of_scope": "Permission caching, expired-session purging and the OAuth store migration are untouched.",
    "estimated_reading_minutes": 7
  },

  "steps": [
    {
      "id": "contract",
      "kind": "foundation",
      "title": "A contract before an implementation",
      "role": "Defines the interface the cache must satisfy",
      "intro": "Before writing anything Redis-specific I pinned down the minimal contract the auth service needs: read, write with a TTL, delete.",
      "detail": "Three methods only. Anything absent (pipelines, scan, stats) is deliberately absent so the service cannot come to depend on it.",
      "files": [
        {
          "path": "src/cache/base.py",
          "change_type": "added",
          "why": "A Protocol rather than an abstract base class: tests can pass a plain dict without inheriting anything, and Redis stays a dependency of the infrastructure layer only.",
          "watchpoints": [],
          "confidence": "high",
          "hunks": [
            { "index": 0, "new_start": 1, "new_lines": 22, "old_start": 0, "old_lines": 0, "label": "new file" }
          ]
        }
      ]
    },

    {
      "id": "wiring",
      "kind": "wiring",
      "title": "Wiring the cache in without changing the public contract",
      "role": "The service consults the cache before the database",
      "intro": "The cache slots into verify(). Signature, exceptions and check ordering are identical, so an existing caller sees no difference.",
      "detail": "The cache is injected by the dependency container rather than constructed inside the service — that is what lets the tests in step 6 pass a fake.",
      "files": [
        {
          "path": "src/auth/token_service.py",
          "change_type": "modified",
          "why": "The cache read happens after signature decoding, not before. A badly signed token must never be used as a lookup key, otherwise the signature stops protecting anything.",
          "watchpoints": [
            "The failure path when the cache is unavailable falls back to the database — confirm this against step 5."
          ],
          "confidence": "high",
          "hunks": [
            {
              "index": 0,
              "new_start": 38,
              "new_lines": 12,
              "old_start": 38,
              "old_lines": 7,
              "focus_lines": [40, 41],
              "label": "def verify"
            },
            {
              "index": 1,
              "new_start": 66,
              "new_lines": 6,
              "old_start": 61,
              "old_lines": 3,
              "focus_lines": [67],
              "note": "The write-back uses the row's remaining TTL, not a fixed one, so the cache entry can never outlive the session."
            }
          ]
        },
        {
          "path": "src/api/deps.py",
          "change_type": "modified",
          "why": "The cache is built once at startup and injected. One instance per request would open a Redis connection per request, cancelling the gain we are after.",
          "watchpoints": [],
          "confidence": "high",
          "hunks": [
            { "index": 0, "new_start": 12, "new_lines": 13, "old_start": 12, "old_lines": 4 }
          ]
        }
      ]
    },

    {
      "id": "invalidation",
      "kind": "delicate",
      "title": "Invalidation on revocation",
      "role": "The core risk: a revoked token must stop passing",
      "intro": "This is the step to read most carefully. Without it, revoking a session would leave the token valid until the cache entry expired.",
      "detail": "I chose immediate deletion over a short TTL. A short TTL narrows the window without closing it, and this needed a guarantee rather than a probability.",
      "files": [
        {
          "path": "src/auth/revocation.py",
          "change_type": "modified",
          "why": "The cache delete runs in the same logical transaction as the database revocation and before returning to the caller: if Redis fails, the revocation fails too and surfaces as an error.",
          "watchpoints": [
            "Ordering is deliberate — database first, cache second. Reversed, a crash between the two would leave a revoked token in the cache.",
            "Bulk revocation (log out all devices) loops over jtis; acceptable up to a few dozen sessions, worth a second opinion beyond that."
          ],
          "confidence": "medium",
          "hunks": [
            {
              "index": 0,
              "new_start": 24,
              "new_lines": 18,
              "old_start": 24,
              "old_lines": 6,
              "focus_lines": [26, 29],
              "label": "def revoke"
            }
          ]
        },
        {
          "path": "src/cache/redis_store.py",
          "change_type": "modified",
          "why": "drop() completes the contract. A missing key is not an error: revoking a token that was never cached is a normal case.",
          "watchpoints": [],
          "confidence": "high",
          "hunks": [
            { "index": 1, "new_start": 30, "new_lines": 13, "old_start": 30, "old_lines": 2 }
          ]
        }
      ]
    }
  ]
}
